{
  "$schema": "https://json-schema.org/draft/2020-12/schema",
  "$id": "https://raw.githubusercontent.com/krisanselmo/rag-mobil/main/schema/inventory-v1.schema.json",
  "title": "Inventory of a Playmobil set (format v1)",
  "description": "An inventory as rag-mobil reads it (--inventory-url, --inventory-file, cache) and writes it (--inventory-json). See docs/inventory-format.md. Unknown fields are ignored.",
  "type": "object",
  "required": ["set_number", "name", "parts", "source_url"],
  "properties": {
    "set_number": {
      "description": "Set number: 1 to 8 digits, optionally followed by a lowercase letter (a revised edition). Must be the one requested.",
      "type": "string",
      "pattern": "^[0-9]{1,8}[a-z]?$",
      "examples": ["3666", "70145", "3258a"]
    },
    "name": {
      "description": "Set name.",
      "type": "string",
      "examples": ["Kings Large Castle"]
    },
    "theme": {
      "description": "Theme (product line), null if unknown.",
      "type": ["string", "null"],
      "examples": ["Knights"]
    },
    "focus": {
      "description": "Sub-theme, null if unknown.",
      "type": ["string", "null"],
      "examples": ["Building"]
    },
    "release_date": {
      "description": "Release date as free text (PlaymoDB: YYYY/MM), null if unknown.",
      "type": ["string", "null"],
      "examples": ["1993/09"]
    },
    "parts": {
      "description": "Contents of the box, one entry per reference. Must not be empty.",
      "type": "array",
      "minItems": 1,
      "items": { "$ref": "#/$defs/part" }
    },
    "source_url": {
      "description": "URL where a human can check the inventory (or any identifier of the source).",
      "type": "string",
      "examples": ["https://playmodb.org/cgi-bin/showinv.pl?setnum=3666"]
    }
  },
  "$defs": {
    "part": {
      "type": "object",
      "required": ["number", "name", "category", "components"],
      "properties": {
        "number": {
          "description": "Piece reference, unique within the set; the LLM cites it in its plan.",
          "type": "string",
          "examples": ["30 00 4950"]
        },
        "name": {
          "description": "Piece name.",
          "type": "string",
          "examples": ["Castle Trumpeter"]
        },
        "color": {
          "description": "Color, null if unknown or not applicable.",
          "type": ["string", "null"],
          "examples": ["red"]
        },
        "quantity": {
          "description": "Number of copies in the box, null if unknown.",
          "type": ["integer", "null"],
          "minimum": 0,
          "maximum": 4294967295
        },
        "category": {
          "description": "Category as free text. Klicky or figure (case-insensitive): a figure, hence a possible character. Paper: instructions, left out of the prompt.",
          "type": "string",
          "examples": ["figure", "Klicky", "Animal", "Furniture", "Vehicle", "Paper"]
        },
        "components": {
          "description": "Sub-items of the piece (a figure's wig, hat…), possibly empty.",
          "type": "array",
          "items": { "type": "string" }
        },
        "image": {
          "description": "Absolute URL of an image of the piece, null or absent if none. Not read by the prompt: used for display.",
          "type": ["string", "null"],
          "examples": ["https://playmodb.org/parts/0/00/30%2000%20495.gif"]
        }
      }
    }
  }
}
